{
  "schema_version": 1,
  "task_id": "brief-demo",
  "brief_revision": 1,
  "brief_digest": "0000000000000000000000000000000000000000000000000000000000000000",
  "status": "ok",
  "acceptance": [
    {
      "id": "coverage",
      "status": "pass",
      "evidence_refs": [
        "reports/evidence.json"
      ]
    },
    {
      "id": "delivery",
      "status": "pass",
      "evidence_refs": [
        "reports/evidence.json"
      ]
    }
  ],
  "artifacts": [
    "reports/weekly.md"
  ],
  "unprocessed": [],
  "blockers": [],
  "assumptions": [
    "资料均为公开网页"
  ],
  "recoveries": [],
  "approval_refs": [],
  "next_step": "等待下周计划；这里只是虚构验收样例"
}
